{
  "kind": "agent_proposal",
  "schema_version": "1.0.0",
  "proposal_id": "prop_0001",
  "task_ref": {
    "id": "task_cr_export_rows",
    "version": "1.0.0"
  },
  "role": "fitness",
  "model": {
    "provider": "anthropic",
    "model_id": "configured-reasoning-model",
    "revision": null
  },
  "prompt_template_ref": {
    "id": "tmpl_fitness",
    "version": "1.0.0"
  },
  "input_refs": [
    {
      "id": "profile_report_acr_demo",
      "version": "1.0.0"
    }
  ],
  "proposed_verdict": "ELIGIBLE",
  "proposed_reasons": [],
  "proposed_next_actions": [
    "Proceed to export"
  ],
  "proposed_artifacts": [],
  "authority": "advisory",
  "usage_record_ref": "usage_prop_0001",
  "created_at": "2026-10-10T00:00:00Z"
}
